{
  "$schema": "http://json-schema.org/draft-07/schema#",
  "title": "Konfigurasi BijiSatu",
  "description": "Pengaturan opsional untuk robot MT5. Kolom yang tidak diisi memakai nilai bawaan yang ditampilkan. Mengubah konfigurasi tidak memperbarui proses yang sedang berjalan; restart robot untuk menerapkan perubahan.",
  "type": "object",
  "additionalProperties": false,
  "properties": {
    "strategy_mode": {
      "type": "string",
      "enum": [
        "scalping",
        "intraday",
        "short_term"
      ],
      "default": "scalping",
      "description": "Memilih strategi tren/pullback EMA dengan candle yang sudah ditutup. scalping memakai entry M1 dan tren M5; intraday memakai entry M15 dan tren H1; short_term memakai entry H1 dan tren H4 dengan minimal 100 candle H4 tertutup (sekitar 400 jam candle). ATR14 dihitung pada timeframe entry. Mode lebih lambat perlu diuji, bukan jaminan profit harian; posisi bisa menginap atau bertahan beberapa hari. Aturan tetap EMA20/50 dan pullback/reclaim EMA20, bukan breakout/retest atau reversal. Mengganti mode tidak menghapus penghentian harian maupun riwayat percobaan entry."
    },
    "max_open_risk_fraction": {
      "type": "number",
      "exclusiveMinimum": 0,
      "exclusiveMaximum": 1,
      "default": 0.05,
      "description": "Batas gabungan risiko yang direncanakan untuk posisi terbuka, sebagai pecahan equity SAAT INI: 0.05 = 5%. Risiko dicadangkan dari harga bid/ask saat ini hingga SL di server, ditambah estimasi komisi buka-tutup dan risk_buffer. Anggaran entry mengikuti nilai terkecil antara sisa batas risiko terbuka dan sisa anggaran harian. Posisi lama tidak ditutup atau diubah ketika equity turun hingga batas terlampaui. Gap dapat menyebabkan kerugian melebihi perkiraan."
    },
    "risk_fraction": {
      "type": "number",
      "exclusiveMinimum": 0,
      "exclusiveMaximum": 1,
      "default": 0.03,
      "description": "Risiko maksimal yang direncanakan per entry baru, sebagai pecahan equity akun saat ini: 0.03 = 3%, BUKAN 0.03 lot. Tidak boleh melebihi daily_loss_fraction. Sisa anggaran harian dan risiko posisi terbuka dapat mengecilkan lot atau membatalkan entry. Gap dan slippage dapat menyebabkan kerugian melebihi perkiraan."
    },
    "daily_loss_fraction": {
      "type": "number",
      "exclusiveMinimum": 0,
      "exclusiveMaximum": 1,
      "default": 0.05,
      "description": "Batas penurunan equity harian sebagai pecahan baseline yang tersimpan: 0.05 = 5%. Mencakup hasil transaksi yang sudah selesai dan untung/rugi posisi terbuka. Jika tercapai, entry baru dihentikan hingga hari broker berikutnya, meskipun equity pulih. Posisi lama tidak ditutup paksa; kerugian aktual bisa melebihi batas ini."
    },
    "max_positions": {
      "type": "integer",
      "minimum": 1,
      "maximum": 10,
      "default": 2,
      "description": "Jumlah maksimal posisi terbuka bersamaan sebelum entry baru diblokir, dengan batas mutlak 10 posisi. Robot hanya mengizinkan satu posisi per simbol. Ini batas atas, bukan target jumlah transaksi; batas risiko akun tetap berlaku. Posisi manual atau strategi lain dapat memblokir entry secara terpisah."
    },
    "max_symbols": {
      "type": "integer",
      "minimum": 1,
      "default": 20,
      "description": "Jumlah maksimal simbol yang dipindai, baik ditemukan otomatis maupun ditentukan dalam symbols. Daftar eksplisit dibuang duplikatnya dengan mempertahankan urutan, lalu dibatasi sebanyak nilai ini. Simbol yang dipindai belum tentu menghasilkan transaksi."
    },
    "poll_seconds": {
      "type": "integer",
      "minimum": 1,
      "default": 5,
      "description": "Waktu tunggu dalam detik setelah setiap pemindaian selesai. Jarak waktu antar pemindaian juga mencakup waktu pemrosesan. Ini bukan target frekuensi transaksi atau timeframe chart; sinyal memakai candle entry/tren yang sudah ditutup sesuai strategy_mode."
    },
    "cooldown_seconds": {
      "type": "integer",
      "minimum": 1,
      "default": 300,
      "description": "Jeda minimal antar percobaan entry pada simbol yang sama: 300 detik = 5 menit. Percobaan disimpan sebelum order dikirim, sehingga rencana dry-run dan pengiriman yang ditolak atau belum pasti juga bisa memulai jeda. Ini bukan batas waktu menahan posisi."
    },
    "max_tick_age_seconds": {
      "type": "integer",
      "minimum": 1,
      "default": 15,
      "description": "Usia maksimal harga bid/ask yang diterima dibandingkan waktu UTC saat ini, dalam detik. Harga yang lebih lama ditolak. Timestamp yang lebih maju memakai toleransi terpisah max_tick_future_seconds. Menaikkan nilai ini tidak membuat sumber harga yang berhenti menjadi segar kembali."
    },
    "max_tick_future_seconds": {
      "type": "number",
      "minimum": 0,
      "maximum": 1,
      "default": 1.0,
      "description": "Toleransi maksimal timestamp harga yang lebih maju daripada jam UTC komputer, dalam detik. Bawaan 1 detik dan tidak boleh melebihi 1. Gunakan 0 untuk menolak semua timestamp masa depan. Selisih lebih besar tetap ditolak; batas usia harga dan validasi candle tidak dilonggarkan. Entry yang terblokir karena timestamp akan diperiksa ulang pada pemindaian berikutnya."
    },
    "max_spread_atr": {
      "type": "number",
      "exclusiveMinimum": 0,
      "exclusiveMaximum": 1,
      "default": 0.15,
      "description": "Batas rasio spread terhadap ATR14 pada timeframe entry: M1 untuk scalping, M15 untuk intraday. 0.15 berarti spread maksimal 15% ATR, BUKAN 0.15 pip. Contoh: spread 0.8 pip / ATR 1.6 pip = 0.50, sehingga ditolak oleh batas 0.15. Nilai lebih tinggi menerima biaya spread yang lebih besar dibanding volatilitas; uji terlebih dahulu lewat backtest."
    },
    "stop_atr": {
      "type": "number",
      "exclusiveMinimum": 0,
      "default": 1.5,
      "description": "Pengali ATR14 untuk jarak SL awal pada timeframe entry: M1 untuk scalping, M15 untuk intraday. 1.5 berarti 1.5 kali ATR. Spread, jarak stop minimal broker, dan pembulatan tick dapat memperlebar SL aktual. Lot dihitung berdasarkan jarak SL yang dihasilkan."
    },
    "reward_ratio": {
      "type": "number",
      "exclusiveMinimum": 0,
      "default": 1.5,
      "description": "Rasio jarak TP terhadap jarak entry ke SL aktual, sebelum biaya. 1.5 menargetkan pergerakan harga sebesar 1.5 kali jarak SL. Ini bukan perkiraan persentase kemenangan atau jaminan keuntungan bersih. Pembulatan tick dapat mengubah rasio aktual."
    },
    "risk_buffer": {
      "type": "number",
      "minimum": 1,
      "default": 1.15,
      "description": "Pengali estimasi risiko SL dan komisi untuk perhitungan lot serta cadangan risiko terbuka yang lebih konservatif. 1.15 menambah cadangan 15%; 1 tidak menambah cadangan. Nilai lebih besar biasanya mengecilkan lot. Tidak menjamin perlindungan terhadap gap atau slippage ekstrem."
    },
    "max_margin_fraction": {
      "type": "number",
      "exclusiveMinimum": 0,
      "exclusiveMaximum": 1,
      "default": 0.8,
      "description": "Bagian maksimal dari free margin saat ini yang boleh dibutuhkan order baru: 0.8 = 80%. Order yang melebihi batas ditolak, bukan otomatis diperkecil oleh pemeriksaan ini. Ini pengaman margin, BUKAN izin merisikokan 80% equity."
    },
    "deviation_points": {
      "type": "integer",
      "minimum": 0,
      "default": 10,
      "description": "Penyimpangan harga entry yang diizinkan dalam point broker, bukan pip. Pada EURUSD dengan lima angka desimal, 10 point = 1 pip. Dipakai untuk pemeriksaan harga sebelum pengiriman, permintaan order, dan estimasi kerugian konservatif. Aturan eksekusi broker bisa berbeda; ini bukan jaminan batas slippage."
    },
    "magic": {
      "type": "integer",
      "minimum": 1,
      "default": 810031,
      "description": "Bilangan bulat positif sebagai penanda order dan posisi robot ini. Jangan diubah selama masih ada posisi terbuka; posisi lama bisa dianggap milik strategi lain dan memblokir entry. Jangan digunakan ulang oleh strategi lain pada akun yang sama."
    },
    "symbols": {
      "type": "array",
      "items": {
        "type": "string",
        "minLength": 1,
        "pattern": "\\S"
      },
      "default": [],
      "description": "Nama simbol broker yang persis untuk dipindai, misalnya EURUSDc dan GBPUSDc jika tersedia. Daftar kosong mengaktifkan pencarian berdasarkan metadata, dibatasi max_symbols. Daftar eksplisit lebih sesuai untuk menguji instrumen tertentu. Beberapa simbol dapat memiliki risiko yang saling berkorelasi."
    },
    "account_login": {
      "type": [
        "integer",
        "null"
      ],
      "minimum": 1,
      "default": null,
      "description": "Nomor login akun trading MT5 untuk mencegah koneksi ke akun yang salah. Bukan email atau kata sandi. null tidak membatasi akun pada mode observasi, tetapi tidak diizinkan untuk --execute. Simpan nomor akun dalam konfigurasi lokal yang dikecualikan dari Git."
    },
    "broker_utc_offset_hours": {
      "type": [
        "number",
        "null"
      ],
      "minimum": -14,
      "maximum": 14,
      "default": null,
      "description": "Selisih waktu server broker terhadap UTC, dalam jam, untuk pergantian hari risiko: 0 = UTC, 2 = UTC+2, -3.5 = UTC-3:30. Konfirmasi ke broker dan sesuaikan jika ada perubahan DST. null memakai UTC dengan peringatan pada observasi, tetapi tidak diizinkan untuk eksekusi. Label sesi pasar memakai aturan zona waktu tersendiri."
    },
    "commission_per_lot": {
      "type": [
        "number",
        "null"
      ],
      "minimum": 0,
      "default": null,
      "description": "Estimasi total komisi pembukaan DITAMBAH penutupan untuk satu lot, dalam mata uang akun. 0 secara eksplisit mengasumsikan tanpa komisi, bukan tanpa spread atau swap. Untuk akun USC gunakan sen, bukan dolar. null dianggap nol saat menghitung lot observasi, tetapi memblokir eksekusi. Gunakan estimasi konservatif jika biaya antar simbol berbeda."
    },
    "terminal_path": {
      "type": [
        "string",
        "null"
      ],
      "default": null,
      "description": "Lokasi opsional executable terminal MT5 yang dituju, berguna jika ada beberapa terminal terpasang. Dalam string JSON, setiap backslash Windows harus ditulis dua kali, misalnya C:\\\\Program Files\\\\Broker MT5\\\\terminal64.exe. null memakai pencarian terminal bawaan paket MT5."
    },
    "state_dir": {
      "type": "string",
      "minLength": 1,
      "pattern": "\\S",
      "default": "state",
      "description": "Folder penyimpanan baseline harian, status penghentian harian, dan riwayat percobaan entry secara permanen, terpisah berdasarkan akun dan mode. Path relatif mengikuti folder kerja proses; launcher memakai root proyek. Jangan hapus, pindahkan, atau edit state untuk melewati batas risiko. Kecualikan lokasi khusus dari Git."
    },
    "log_dir": {
      "type": "string",
      "minLength": 1,
      "pattern": "\\S",
      "default": "logs",
      "description": "Folder log harian append berdasarkan UTC, tanpa penghapusan otomatis. File .log dan console ringkas; .jsonl menyimpan detail terstruktur. Bawaan INFO; --verbose mengaktifkan DEBUG dan detail penuh yang dapat cepat memenuhi disk. Status berulang dicatat sesuai heartbeat_seconds, bukan setiap perubahan equity/quote."
    },
    "heartbeat_seconds": {
      "type": "integer",
      "minimum": 1,
      "default": 60,
      "description": "Interval pengulangan status yang tidak berubah di terminal, diperiksa setelah setiap pemindaian. 60 berarti sekitar sekali per menit; pemindaian lambat dapat menundanya. Perubahan status dilaporkan lebih cepat. Tidak mengubah frekuensi pemindaian, aturan sinyal, atau frekuensi transaksi."
    },
    "ollama_observation_enabled": {
      "type": "boolean",
      "default": false,
      "description": "Mengaktifkan penilaian sinyal oleh Ollama lokal secara terpisah, hanya untuk observasi. Penilaian tidak menyaring entry, mengubah risiko, mencatat klaim percobaan, atau mengizinkan order. Bawaan nonaktif; berbeda dari pilihan dry-run atau execute."
    },
    "ollama_observation_endpoint": {
      "type": "string",
      "default": "http://127.0.0.1:11435",
      "description": "Alamat HTTP lokal untuk observasi atau filter melalui POST /api/chat. Runtime hanya menerima localhost atau alamat loopback IPv4/IPv6 literal dengan port opsional, tanpa kredensial, path, query, atau fragment. Tidak memakai DNS, proxy, atau pengalihan alamat."
    },
    "ollama_observation_model": {
      "type": "string",
      "default": "qwen3:4b",
      "pattern": "^[A-Za-z0-9][A-Za-z0-9._:/-]{0,127}$",
      "maxLength": 128,
      "description": "Nama model Ollama lokal yang sudah terpasang untuk observasi atau filter. Model tidak diunduh otomatis. Nama harus 1–128 karakter, terdiri atas huruf, angka, titik, underscore, titik dua, slash, atau tanda hubung. Persetujuan filter terikat pada model yang diminta."
    },
    "ollama_observation_timeout_seconds": {
      "type": "number",
      "default": 10.0,
      "minimum": 0.1,
      "maximum": 30,
      "description": "Batas waktu total permintaan observasi atau filter dalam detik, termasuk koneksi, pengiriman, dan pembacaan respons. Pemrosesan CPU bisa melampauinya; observasi hanya mencatat kegagalan, sedangkan filter memblokir entry. Persetujuan filter kedaluwarsa maksimal 30 detik sejak antrean dibuat. Saat shutdown, waktu tunggu maksimal adalah batas ini ditambah 0.2 detik."
    },
    "ollama_observation_queue_capacity": {
      "type": "integer",
      "default": 4,
      "minimum": 1,
      "maximum": 32,
      "description": "Jumlah maksimal snapshot menunggu, di luar satu permintaan aktif. Satu worker memproses antrean tanpa menahan pemindaian. Jika penuh, unavailable dicatat tanpa mencoba ulang simbol/candle; observasi tidak menyaring order, sedangkan filter memblokir entry tersebut. Komentar pasar memakai slot batch awal sebesar nilai terbesar antara kapasitas ini dan max_symbols, dibatasi 32; filter dan observasi sinyal tetap memakai kapasitas ini."
    },
    "ollama_filter_enabled": {
      "type": "boolean",
      "default": false,
      "description": "Mengaktifkan filter entry lokal: sinyal strategi DAN persetujuan Qwen yang valid, cocok persis, dan belum kedaluwarsa wajib tersedia. Bawaan nonaktif; tidak boleh bersamaan dengan ollama_observation_enabled. Pending, skip, timeout, respons tidak valid, antrean penuh, atau layanan gagal memblokir entry baru tanpa menunggu worker. Model tidak mengubah lot, SL/TP, atau risiko; opsi ini bukan izin execute."
    },
    "market_commentary_enabled": {
      "type": "boolean",
      "default": false,
      "description": "Mengaktifkan komentar pasar Qwen pada candle entry tertutup terbaru saat mulai dan setiap candle baru, termasuk simbol berposisi bila data pasar dan pemeriksaan risiko aman. Bawaan false; terpisah dari filter entry dan observasi sinyal. Bias buy/sell/neutral dan alasan bukan izin transaksi. Data EMA/ATR/candle tervalidasi saja; tanpa akun, saldo, atau order. Maksimal satu permintaan per simbol/candle/mode per proses, tanpa retry timeout. Antrean terbatas mengutamakan filter entry, timeout tetap mengikuti ollama_observation_timeout_seconds."
    }
  },
  "allOf": [
    {
      "not": {
        "properties": {
          "ollama_filter_enabled": {
            "const": true
          },
          "ollama_observation_enabled": {
            "const": true
          }
        },
        "required": [
          "ollama_filter_enabled",
          "ollama_observation_enabled"
        ]
      }
    }
  ]
}
